review_text,rating,thumbs_up_count,app_version,source
"pathetic withdrawal process for its own wallet. withdrawal time is unnecessary for holding for 48hrs. you should pay interest to hold customers money for long after withdrawal transactions. after the trade you're taking t+1 day to get the balance available and after withdrawal 24hr , if late payment you take interest from customers then pay the interest to the customer for holding their money. and a big frustrating customer service you have. please help them to learn ethics on call.",1,5,18.8.1,google_play
nifty and sensex tab made smaller. difficult to click tab,1,1,,google_play
very good app for investment i love it,5,0,18.8.1,google_play
want 3/6/12 months trading view candle stick chart,4,0,18.7.1,google_play
"doesn't work properly when a stock's demergers happens, reports unnecessary loss, while the price reduced due to split of the stock.",2,4,18.8.1,google_play
"after the latest update, the commodities section has become very confusing. prices are now shown in percentage instead of actual figures, which makes it difficult to understand real values at a glance. this change has negatively impacted the user experience, especially for those who actively track commodity prices. please bring back the option to view prices in actual figures or allow users to switch between percentage and value. right now, it feels less intuitive and not user-friendly at all.",1,3,,google_play
chart problem closing candle time not reflect time to time.,1,0,18.8.1,google_play
does this app support xiaomi pad 7 ? compatible or not ? and what are the charges after 1 year,3,0,,google_play
customer care service is very poor and i am disappointed,1,0,18.8.1,google_play
its problematic in options trade gives a lot of trouble. it hangs in between. also lagging in actual prices.,1,1,,google_play
yesterday i lost 4k because of app. reason: when i am trying to navigate app got stuck for few seconds i tried clicking 2 or 3 times and after few seconds it got responded and result is my shares got soldout at 1 rupees lesser than market price... 1st of all as when sell window opens app chooses always lesser than market value don't why.... 2nd why you are selling below the market price even if user is selecting a price below market don't know why...,1,9,18.8.1,google_play
"this adv kills me. foolish adv, repeats many times and when ever the cell phone is opened. i will go to court both on samsung and grow if you don't take immediate action.",1,0,16.00,google_play
"this app silently deducting brokerage charge even if the transaction is unsuccessful. people need to pay attention on this. why it forcefully asking to approve autopay if i don't want to, for sip installments?",1,2,18.8.1,google_play
"don't use this app. i opted out of linking my mutual funds to a demat account last year, yet after changing my mf amount this month, the funds were automatically credited to the demat account. it feels like they're deliberately forcing customers to use demat and pay extra charges. sebi should take strict action against this practice.",1,5,18.8.1,google_play
my p&l are profit but brokerage make me very loss. very high brokerage,1,0,18.8.1,google_play
issue with account status – unable to access groww account,5,0,18.8.1,google_play
many indicator not apply on chart . something application not working. it's option chain is difficult to read. some indicator not working after apply on chart,1,1,,google_play
very very poor responce from your champions despite several request and reminders. every times says the same answer that is your problems already solved but till today not attended,3,3,18.8.1,google_play
"why is there no p and l calendar? and please don't ask me to mail you the concern on your email,i think my statement is pretty clear in itself.",1,0,18.8.1,google_play
the charges are so heavy and the customer care also bad,1,0,,google_play
.. first time it will give cash <URL> is a planned platform.... we put call option .. it will increase put options.. such waste of time and money loss...,5,1,18.8.1,google_play
the worst app most of the time when is volatility in the market it freezes and stops showing the execution and price action and the customer is worse then anything they never gets help from. one single day just because it got frozen i exit from the and re launched it by the time i had loss around 54489 .. they just scam people please it's my request don't go with grow it never helps you to grow go with zerodha far better than this.,1,1,,google_play
"from past 1week am observing hung, due to this delay/hung am not able to buy/sell accurately. this causing me loss. please fix this issue",2,0,18.8.1,google_play
i'm very fed-up about this app. i was invested here before two three years ago but suddenly i was unable to log in this app. whenever i'm trying to login to this app everytime they ask for a new pan i'd. how many pan i'd will be have a single person. today is 5th of april 2026 but still i'm stuck here with the same problem till 2024. so guys before investing here think once,1,1,18.8.1,google_play
stupid app. unable to give pin even before that app goes back to homepage,1,0,18.8.1,google_play
great app to use should provide some prior information about equality share like when the meeting going to be held,4,0,18.7.1,google_play
user friendly and good for new user to get suggestions for stocks,5,1,18.8.1,google_play
"groww has completely transformed my investment journey. the interface is incredibly clean and intuitive, making it easy for both beginners and seasoned investors to navigate stocks and mutual funds. i especially appreciate the transparency regarding charges and the seamless kyc process. it truly is a one-stop solution for wealth creation.""",5,0,18.2.1,google_play
order not executed as per stop loss. customer support very poor. they will just use the script to respond without trying to solve the issue. they will say they understand the problem but in fact they have no clue how much they have hurt their customer.,1,10,18.8.1,google_play
very bad experience...oder not executed even not cancel .....,1,1,18.8.1,google_play
this is the app to fool the public.,1,0,18.8.1,google_play
"groww is froud app, chart go positive side and call option price go negative side, due to this i lost 300k in 2 month, don't install this app",1,0,,google_play
"there should be option to give alias name to your funds as well. eg: if i am having 3 goal for which let suppose am running sip for some amount in hdfc targetted for flat . in debt fund i am keeping money for admission, another fund for future abroad vacation . so there is always a targetted amount as well as priority also. i want to keep name to those funds to keep myself clear and help myself looking on dashboard easily. may be just alias name as a suffix of fund name would be helpful",4,5,18.8.1,google_play
"""you can add money anytime, but for withdrawals, you only allow it on monday at 10 am — what kind of rule is that? you take money whenever you want, but when it comes to withdrawals, users are forced to wait. this app is absolutely useless. my honest advice is to uninstall it. the service is completely terrible.""",1,13,18.8.1,google_play
"after updating app, oi is not being available in option chain.",3,1,18.8.1,google_play
the assistant does not answer my question properly . they end conversation within a minute . they don't assist . i had mtf related question where i was charged 10 times than usual and one of them just said you requested 10 times . every morning the unpledged amount automatically got pledged and deducts my money. unpledge failed but money deducted but still they can't provide satisfactory answer for my querry. maybe it's the right time to quit and try alternative . too much charges for beginers,1,12,18.6.1,google_play
"the owner and developer should be more open and disclose all the charges, whether be in mf or shares.",4,0,18.8.1,google_play
when it will have update for scalping mode on one screen showing two chart call/ put and index chart /stocks and buying or selling from the same chart?,3,0,18.7.1,google_play
very poor customer service - unable to address customer queries. just cut paste response. security is a big concern. your portfolio gets accessed by their other company without any check response to issues raised take a lot of time and follow ups,1,9,18.8.1,google_play
"high charges for delivery, they charge you for every sell transaction even though stock is same .. other apps dont do that planning to move to dhan or indmoney",1,5,18.8.1,google_play
"groww, you collect a lot of unnecessary data through app tracking and lack transparency.",1,0,18.4.3,google_play
many time you will observe value are different from nse and they give excuse of net slow and software not updated,1,1,18.8.1,google_play
got fed up with app and it's customer service. they think that the person who are using to their app are idiots. crashing during trading and hanging in between order placement. no triggering of alerts on time. despite regular update and installation after deleting the app problems are existing same. cherry on top they charge highest brokerage among any app available.,1,0,,google_play
"this is a stupid app. it is better to invest in forex market and make good profits. brokers treat it as if they will get profits worth lakhs. i am telling everyone not to trust the app. better to invest in sip, the money will be less in future.",1,1,,google_play
i dont like this dont show this add offen,1,1,,google_play
"the customer service of grow is not good, withdrawal option is not available, they deliberately delay our amount for two days vr bad service from groww a friend suggest me for this but no any proper response from groww customer care i never suggest for this application.",1,8,18.8.1,google_play
add percentage option in scalping target percent and sl percent and amount option not at market.,5,0,17.64,google_play
groww service day by day is growing to worst <URL>r hard money is deducted without any proper clarification .they are just fooing to peopes so please avoide groww ad ita time to switch to new platform.,1,2,18.8.1,google_play
very much dirty app comes in phone again and again,1,1,,google_play
all are good but there is one thing missing that is layout...,3,0,18.7.1,google_play
"recently u r app quality has deteriorated vastly, app crashing, groww balance disappearing and loading after 30min , mf sip auto pay not working, stock classified incorrectly, tax implications not mentioned for many mutual funds.. most annoying is ur support team closing tickets without remedy and with answering to the query just pushing the ball to our court saying i called u , but u didn't respond. either i respond or not, issue is clearly mentioned, they just reply it is resolved or wip",1,9,18.8.1,google_play
my order didn't executed for 10 min i tried and tried chat with their help support and they placed when all profit gone . i loss my 16000 profit give it back groww it's all your fault,1,0,,google_play
"i've been using the groww app for a while now, and overall it delivers a clean and beginner-friendly investing experience. the interface is simple, intuitive, and makes it easy for new users to start investing in stocks, mutual funds and easy to add or withdrawal money",5,8,18.7.1,google_play
the taxes and brokerage is costlier compared to dhan and zerodha but the smooth experience makes me forget that and it makes me wanting to stick with this app for trading but thee only thing which i fit is missing is 1) the trailing sl and target directly from charts(like the ones in <PERSON> app) which makes quite easier to trail both sl and target levels. 2) changing between stocks which are added your personal created wishlist from charts itself.,3,5,18.7.1,google_play
this is the worst service by grow. during trading time how can this happens. grow doesn't open since a hour. who will pay my loss?,5,1,18.7.1,google_play
it is a very good app it is very useful i like it,5,1,,google_play
"i have lost my life in this app, i lost around 35 -40 lakh rupees in total trading f&o. i completely became obsessed with this but no matter what i take if i pick call and wait it goes put if i wait for put it goes call. don't ever do f&o i have a family and lost job and life due to this app",1,1,18.1.1,google_play
worst experience! i lost lots of money due to late execution. outdated features with high brokerage charges.,1,3,18.8.1,google_play
instead of wasting money on advertisement you should invest money to improve your apps ui every time i try to open charts like stock or index chart it take much more time to load and mostly it says enable to load the chart,1,8,18.8.1,google_play
so much glitch in f&o trading even after calling to support team!,1,3,18.8.1,google_play
when i suppose to sell it for example 135 and it is on 134 it doesn't sell and today that's why i got 2000 loss,3,3,18.8.1,google_play
showing the wrong track history and portfolio calculation which makes it hard to analyze my investment,2,0,18.8.1,google_play
all is topnotch but sometime it doesn't trigger set target prise.,4,1,,google_play
in grow app trading view chart is not working(9:15am to 3:30pm) . slove this trading view chart problem.................................................................................................................................................................................................................................................................................................................................................... ........................................................,1,4,18.8.1,google_play
"pay attention to the prices and your money while trading on this groww app. multiple discrepancies, lags while doing transactions. after settlements, they deduct more amounts. the auto-square off didn't work and the intraday trade was dragged beyond 3:20 auto-square off time. many transactions look shady due to discrepancies. customer support, app calls and emails, is worst. no resolution, help, eta, or support after numerous attempts. better use a different reliable app.",1,3,,google_play
the app structure for daily adjustments in wallets is not better and not showing the charges and daily trade details properly,1,0,18.7.1,google_play
"i like the app, please include one cancel other order (oco) feature for delivery trading.. and i want to see the sector/industry performance by 1d,1w,1m,3m,6m,1y timeframes with sort option, and historical data (previous days daily percentages)",3,7,18.8.1,google_play
every day asking update. index expiry day asking update. always asking update. particularly when taking order,1,3,18.8.1,google_play
i use grow app is more than 5 year but now grow is very bad and irritated app because i trade and app is not working properly slowly and hang very big bug not exit very early and much issues now i wil losses make to this app is bug <URL> now some day i thinks is app owner game <URL> plz not use grow my 5 year trust will now end ...i uninstall this <URL>ry very very very badddd and you ask to ai answer is worst app for trading.,1,0,,google_play
"initially i was using three apps, zerodha, angelone, and groww, now i use only the groww app, all essential features with just one touch.",5,0,18.8.1,google_play
"i am very disappointed with groww. the platform charges high fees on almost every transaction, whether the investment amount is small or large. there also appear to be extra or hidden charges, making it costly for investors. these high costs reduce overall returns and make the experience frustrating. groww should improve transparency and lower its charges to support small investors. currently, it does not feel user-friendly or affordable.",2,8,18.8.1,google_play
slow speed & update on app for f&o as compare to zerodha app. <PERSON> is faster execution compare to groww,1,1,18.7.1,google_play
app is not <URL>ird class app.. don't trust....,1,0,18.7.1,google_play
"minimum 3 updates in weakly, then neither proper depth is shown nor chart, day by day service is getting lost",5,2,18.8.1,google_play
"they charge too much! almost zero profit. not recommended! one more thing: you can't withdraw your money after crediting your groww account, unless you've have used that money to trade first, (suffer gain or loss) only then you are allowed to withdraw. simply put, your money is stuck the moment you transfer it there.",1,12,18.7.1,google_play
i am using your app since 2023 regularly in f&o and i am very very disappointed about yesterday around 27/04/2026 3:15 there was a glitch in your application because of this i couldn't able to exit with 24350 call. this is horrible. now i am unable to continue with groww any more,1,5,18.7.1,google_play
"profile analysis is not working sold stock is also showing, as a holding kindly fix",1,0,18.7.1,google_play
too much brokerage i do withdraw but still when i try to delete/ close my account it shows you need to pay 0.17 rs what the hell was that? it's not even brokerage charges,1,0,,google_play
"extremely disappointed with the gtt feature lately. i've stopped receiving critical gtt execution notifications, which used to work fine. despite raising multiple complaints, the issue persists. in trading, every second counts—this lag is unacceptable!",1,10,18.7.1,google_play
app are good but i can't add monney due to technical issue,4,0,15.47,google_play
grow app is giving good insight as well analyse of your investment,4,0,18.7.1,google_play
"@groww, this app is not working in landscape mode, please try to fix it. overall good.",3,2,18.7.1,google_play
not as expected. 1. unable to find all report at one place. 2. not able to show mf linked with groww only once you had extracted your external funds. so you can't check performance of your mf purchased through groww. 3. mf can't be adjusted as per your own will. supposed if you want to change your sip from monthly to weekly it is not possible in grow. 4.,2,1,18.7.1,google_play
they keep showing bugs like invested amount to 0,3,1,18.7.1,google_play
i'm using this app around 6 years... transaction charges are very high as compared to other apps & execution is very slow .... kindly reduce price otherwise lots of people quite the app,1,7,18.7.1,google_play
"very poor experience with groww. during market hours, i was unable to exit my position manually even before 3:20 pm as the app was unresponsive. my intraday position was then delayed in square-off from 3:20 pm to 3:25 pm (as confirmed by their support). in those few minutes, my trade went from 927 profit to 2000 loss. in intraday trading, even small delays can cause serious losses. this raises concerns about platform reliability during critical times. please consider switching to another broker",1,2,18.7.1,google_play
"the app doesnt load and currently just not able to use the app at all. not able to connect to support either via chat or phone, or email.",3,5,18.7.1,google_play
worst customer support service there is an issue with return values,1,0,18.7.1,google_play
"<PERSON> app, be careful. non supportive customer care. maximum time number not connecting. call cut down in between conversation if somehow connects. app frequently crashes. today it crashed when i tried to exit from f&o and it doesn't load data. throwback errors. due to which i got into negative money and market closed and my money put on hold. now, tomorrow is expiry and all premium will be cut out. i lost money. i am definitely uninstalling this app after collecting whatever left with me.",1,12,18.7.1,google_play
one of the worst experience today when i saw the mutual funds holdings amount wrong. i don't want to continue with this app anymore. every now and then the app shows wrong data. i have lost faith in this app. now u guys have made mf demat based which is difficult for me to shift.,1,9,18.7.1,google_play
"<LOCATION> number one top broker.. very fast, simple. many many thank you groww",5,0,,google_play
"great app! please add complete charts for 1hr, 1d time frame, currently it shows only 3 months data. which limits analysis to a certain time frame only",3,4,18.7.1,google_play
the customer support service is quite poor; please fix it.,3,0,18.7.1,google_play
"it's the worst, i was investing for like 13 months in two sip's and cancelled one of them today but after doing this my dashboard is showing less than 50% of my invested amount. before cancelling one of my sip my dashboard showed 5000 something and now it's spinning only 1000 something. i wanted to raise this query on their helpline but their chatgpt isn't working and also whenever i try to call on their helpline number it always does it's busy. so if you love your money, keep it away from groww",1,16,18.7.1,google_play
"one day this app give problems near expiry after 3 , will give you huge loss in option , not fully reliable at all, due to app problem u will made loss",1,6,18.7.1,google_play
cant see my mutual fund dashboard after new update,1,0,18.7.1,google_play
"this app is very worst worst app, regarding <URL>stomer care not responding 2. app strucked in between option buying/selling 3. many complaints given but no response",1,1,18.7.1,google_play
always technical issues.. my sip dashboard not proper show.. i always try to customer but always line is busy.,1,4,18.7.1,google_play
why does everything is wrong? completely wrong data visible for my mutual funds. i harvested amount is modified. mf central statement shows updates data but here on your application everything is wrong. please fix it as soon as possible.. this will help me.,1,0,,google_play
all of sudden all my mf are gone i am seeing my old portfolio now about 2 months old one. both on web and app. i am afraid now,1,0,18.7.1,google_play
wrost app i ever use specially for mutual fund.some time show different balance then available balance,1,0,18.7.1,google_play
this application is very useful classy and smoothly run in window i really like this application.,5,4,18.8.1,google_play
server down. failed to trade today for 1 hour. failed to add money,1,0,,google_play
after latest it is showing less investment than actual in mutual fund,1,0,18.7.1,google_play
fair from any other similar app rating decrease from earlier,4,0,18.7.1,google_play
five stars from me because this app gave me a new means of earning which allows me to do my other work without any hindrance.,3,1,18.7.1,google_play
order had been excited but not showing in balance credited and showing something wrong what's this ?,1,0,,google_play
what is your technical team doing? the app crashes every time in critical situations.,1,0,,google_play
taking high charges and giving useless service during trade.,1,1,18.7.1,google_play
today i was buying a call in the itm option and i had sufficient balance actually i had 5 6k extra than the balance needed but my order was still not placed i tried again and again and now i am not able to view my balance i am not able to contact the customer support i am really disappointed and now i am just changing my broker,1,9,18.7.1,google_play
not reliable for regular traders. it lags in the peak time and you can loss you huge money in the minutes. in my personal experience i was trying to close the trade or trying to convert it into delivery on 3:10 pm but due to error in the app i was not able to either close or extend it and has exit on its own not recommend at all.,1,10,18.6.1,google_play
cash withdrawal issues manegement intentionally stuck the withdrawal after waiting <URL>ry bad experience several times for money withdrawal,1,0,,google_play
"grow is unable to modify my sell price, resulted rs. 39000 loss.",2,0,18.7.1,google_play
"again today i am unable to buy or sell share ,and i have loss ammount",1,0,18.7.1,google_play
at the moment when i sell my option primium groww suddenly can't work wht i do,2,0,18.7.1,google_play
sometimes app does work when it's important to make a trade,1,0,18.7.1,google_play
i am not able to see my holding! solve this issue asap!,1,0,18.7.1,google_play
app crashed. error:failed to load data. unable to see or do anything just before market close.,1,0,,google_play
added money today but app shows no funds !!!!,1,0,18.7.1,google_play
sometimes i am getting something went wrong (data fetching minious into an error) on screen.,3,0,17.59,google_play
i was using groww from past maybe 2 year ... but now i am going to delete it. they are taking too much charges maybe this app is good for investing not for trading at all,1,7,18.7.1,google_play
"since 3 year i am unable to use biometric, multiple attempts done by uninstalling and reinstalling app.",1,3,18.8.1,google_play
there is no swp option in this groww app(mobile app) that's why i gave 4 stars rating only. we want swp option in this app for more investing in mutual funds. which app has swp option for mutual funds that is the good. dear groww app team members please insert swp option for investing in mutual funds.,4,2,18.7.1,google_play
market goes up but the price go down for call side this is glitch ? or application issue please solve it .,3,0,16.79,google_play
"be careful, their calculations are wrong on the balance. not sure whether they are doing this intentionally to lure money. then, their customer support. create a ticket, in 1 hour they will close the ticket just giving some random reply.",1,9,18.7.1,google_play
app interface is very good stock research is also good best ui need some accuracy in changes,5,4,18.7.1,google_play
"don't use groww , mtf system is very bad , amounts, credits and bedits regarding mtf is not showing properly don't use this app for mtf",1,0,,google_play
