review_text,rating,thumbs_up_count,app_version,source
"very nice app for those looking for trading, investing in equity and mf.",4,0,18.9.0,google_play
blocked money for the stocks sold on trading day.,1,0,18.9.0,google_play
fast and smooth experience please add oi profile indicator,5,0,18.9.0,google_play
"pls add indicator layout saving feature across the devices , indicator applied keep getting deleted",3,0,,google_play
i am giving you a 4star because you don't have any us stock pls add as soon as possible,4,0,18.8.1,google_play
this app are very high levels brokege and withdrawal money problem any time,1,0,,google_play
user friendly. stock buying and selling process is also very easy.,5,0,18.8.1,google_play
upi option now removed and only net banking is available now,1,0,,google_play
very good you are simple growing trending app,5,0,,google_play
iam just beginner i have learn stocks in groww app nice experience,5,0,18.8.1,google_play
"pathetic app with totally useless customer service. they could not do the onboarding even after almost a week, always blaming the bank and everything but themselves. imagine how bad they will be during actual use! deleted data, closed account and uninstalled. suggest you do the same.",1,3,18.9.0,google_play
"f&o activation taking many days in this app,,no solution even after complaint to groww team from one week.lets see",1,0,18.9.0,google_play
its as logging probable i'm not able to logging in this app since 2 months,1,0,,google_play
good app for stocks and mutual funds. plz don't use it to buy bonds. you dont get any service or reports to help track monthly payouts. you have to rely on your own bank statements and manual tracking and mailing. groww does not have any tracking report to help you. there are other apps with much better features and options for bonds.,3,5,18.9.0,google_play
not good for trader highest charge for trade and trading charges is immediately cut the trade <URL>d not add any trade profit to trade balance,1,4,15.96,google_play
"thief app worst app, always auto square off , when customer get more loss. they have setting from share market to make profit. i have always have bad experience <URL>ought the share closes at profit , they show loss.",1,2,18.9.0,google_play
"holding analysis doesn't have option to see how much overall % allocation in largecap,midcap,smallcap mutual fund is holding...",2,1,18.9.0,google_play
groww terminal is very easy to use trading opportunities nevar miss,5,0,18.9.0,google_play
"""using groww has been a smooth and beginner-friendly experience. the app interface is simple, easy to understand, and makes investing in stocks and mutual funds very convenient. the account opening was quick, and transactions were fast and secure. overall, groww is a great platform for new as well as experienced investors."" but one more suggestion about the desktop qr login option provide in our app & sector wise watchlist inbuilt",5,0,18.9.0,google_play
the groww app opens in vertical mode but does not open in horizontal mode tablet,5,0,18.9.0,google_play
a nice stock market gives a higher amount of cashback in each deposit and is very safe and secure to use,5,1,,google_play
<PERSON> improve as previous and instant withdrawal is also available.....,5,0,18.9.0,google_play
grow scalper is not correct. when grow show marke downward the market goes upward...,1,1,18.9.0,google_play
very nice and easy to use and understanding application..,5,0,18.9.0,google_play
this app is very simple and user friendly specially for beginners. thanks to groww team,5,0,18.9.0,google_play
exorbitantly hi brokerage charges for stock trading. they are so high that i have stopped using the app. won't recommend anyone,1,0,18.9.0,google_play
for trading app i use it since 2020,5,0,18.9.0,google_play
# very hard to manage fno trade # scalper mode is too outdated # no entry and exit feature on chart # no split chart window features # high brokrage zero features @ this app not made for fno mobile trading you confused everytime and stuck in loop for manage trade or looking chart and this results you may book loss even if you are in profit # my advice you may look for better app for fno segment .,1,0,17.91.1,google_play
excellent <URL>ggestions notification also too good on time to time change in market,5,0,18.9.0,google_play
"account close is not easy here, customer support smartly delyed, my experience is not good on this app, i deside to stop using now.",1,3,18.9.0,google_play
"global indices ( global financial markets) is missing in the groww <URL>ke us makets, european markets, assian markets, australia markets , <LOCATION>, african markets or certain global indices like commodity,bond equity and future,for track global markets, monitor to support investment,information and decision for investors, world wide . please update valuable features . thanks .",2,0,18.9.0,google_play
"easy to use. clearly update my portfolio. brokerage is high in stocks but for mf, it is the best. ui is easy to understand.",5,3,18.9.0,google_play
wow app . nice app. good to use .,5,0,18.9.0,google_play
this app is scam . i withdraw money from this app and it didn't receive from 5 days .,1,0,,google_play
they are not showing any deducted money in any transaction history. without any any information they are deducting peoples money. too much platform charges,1,0,18.9.0,google_play
showing wrong expense ratio in mutual funds.. expense ratio changed almost everyday making confusion,2,0,18.9.0,google_play
wasy to use and all the thisngs ure easy for understand step by step,5,0,18.9.0,google_play
profit centred company groww . unfair policy will lead of this app to shutdown in future. they are thinking to loot people for how long dear founders of this app. a day will come u will have closed the loot. government will take action against them for sure in future. groww charge is scam kind of. better i will go with my own bank. for investment.,1,0,18.8.1,google_play
"even intraday trading charges are very high. along with brokerage, external charges and taxes are also levied.",1,1,18.9.0,google_play
the experience has stayed smooth even after regular use. that consistency matters because i've tried apps before that became frustrating after a few weeks.,5,0,18.1.1,google_play
simple and transperant app. one suggestion. indices row in home page be larger in font size and must contain percentage variation as you had in earlier versions.,4,8,18.9.0,google_play
"""groww is very easy to use and best for beginners. investing in stocks and sips becomes simple with this app. clean ui and smooth experience.""",5,0,18.8.1,google_play
nice app with quick support easy to invest or trade..,4,0,18.9.0,google_play
simple... tooo good.... inthis app very convenient feel safe...,5,0,18.9.0,google_play
super and easy to sell and buy stocks.,5,0,18.9.0,google_play
very bad option <URL> intraday in selling and options trading strategies and basket <URL>alper is for buying encouraging dangerous option buying habit.,1,1,18.9.0,google_play
bad experience too much brokerage cut in mtf angel one is good,1,0,18.9.0,google_play
"best trading app for traders in sip,fno etc",5,1,18.9.0,google_play
your ai sucks. if you do not have manpower higher one from market. you seems to relying solely on ai. this is leading to customer like us suffer and find it difficult to get the issue fixed.,1,1,,google_play
i'm facing an issue in the bank but nothing has helped by groww support staff.. what to do,1,1,18.9.0,google_play
opening unknown world of investing to common people in <LOCATION> for <LOCATION> thanks groww best luck,5,1,18.9.0,google_play
"loss safety or protect profit, doesn't work.. i have lost my capital due to sudden reverse movement. failed to protect my capital. so pathetic app. i will not suggest anyone to use groww.",2,1,18.9.0,google_play
3 start because my friends see's loan against mutual fund but i dont see option in my app,3,2,18.9.0,google_play
"very nice to using tranding, investment and sip",4,2,18.7.1,google_play
"don't trust portfolio, holding data , my actual portfolio is in loss but showing profitable. don't blindly buy or sell your stock , all value are mis calculated. groww developer team work on maths side. your niche is simplicity, don't make it complex . my stock avg price is 104 but after selling 50% share , my stock avg price show 87 now, they now averaging my price from share which is available in my portfolio not from overall, it create confusion.",1,7,18.9.0,google_play
in the personal detail screen page in the doesn't available the gender change options. just shows the gender title text.,1,1,,google_play
groow you have work more on your <URL>e chart didn't open quickly it stuck,1,1,18.9.0,google_play
"stay away from stock market , my suggestion to all.",4,0,18.9.0,google_play
app is very good but it takes to much time in processing fee,2,1,18.9.0,google_play
"now, this apps work great and good customer support",4,0,18.6.1,google_play
extremely excellent platform. the magic is in the simplicity and ease of use.,5,0,18.9.0,google_play
main thing which i like most about grow app is transpency and no hidden chrges and simple interface to learn there are lots of things which makes grow different from others.,5,2,18.9.0,google_play
i started the pan/kyc process on groww but did not complete account creation. i want to cancel the onboarding process and request deletion of my unused personal information from your system.,5,0,,google_play
"thats nice great app to build wealth , but groww you need to build an option to invest out of country investments too, like us , <LOCATION>, <LOCATION> etc, that will help us to invest globaly to make wealthy portfolio. :)",4,0,18.9.0,google_play
very simple to use with easy with reports which can provide analysis and help you to take decision.,5,0,18.9.0,google_play
very nice and fantastic apps for investment in stock market,5,0,18.9.0,google_play
taking so much hidden charge on delivery and intraday trading #worstapp,1,0,,google_play
"very high brokerage charges... my advice is don't waste your valuable money, time & don't spoil your mental health too.",1,1,18.9.0,google_play
definitely depends on self interest... however.. for me it's interesting n helpful,5,0,18.8.1,google_play
"easy to operate, clear instructions given end of the day.",5,0,18.9.0,google_play
best app to learn mutual fund and stock market,5,1,18.9.0,google_play
"it is very easy to use, and all matters are clear and transparent, leaving us with no significant risk of fraud or loss.",5,0,18.9.0,google_play
excellent trading app ...but trading taxes is little bit high,5,0,18.9.0,google_play
i would like to thank groww app because the app everything provide for the customer satisfaction and one more thing the group credit app is also good for the instant personal loan anytime anything you need just do it for grow credit,5,0,16.70,google_play
"best app for stock market, bonds, trading and sip broker charge is high but provided facility outstanding.",5,0,18.8.1,google_play
this is the best broker ever i have seen,5,0,18.9.0,google_play
"dear groww team, it's appreciated that you regularly bring updates and improvements to the app. however, in the recent update, the size of the nifty 50 and sensex view options have been reduced. kindly make those buttons/options slightly bigger and easier to click, as they are important features that users access frequently. a larger and more visible touch area would improve the overall user experience. thank you.",5,7,18.9.0,google_play
"very bad app, a lot of money is charged, no refund",1,2,18.9.0,google_play
"i don't know, i'm first time here n i'm satisfied",5,0,18.9.0,google_play
good experience with this selling buying was too simple and it's good application for beginners to start investing today,5,0,18.9.0,google_play
thrid class credit app and process fees to much costly and to much highly interest rate,1,3,18.9.0,google_play
groww customer call service is pathetic nobody is take your query calls and there is a an issue as well in this application because unable to raise 2 or more query tickets. it shows ticket raised but the actual ticket is not showed anywhere in this application.,3,14,18.9.0,google_play
"very poor experience with groww commodity trading. chart candles lag and don't match actual market price, leading to wrong entries. i placed trades based on support/candles, but price had already moved. even after raising multiple complaints, there is no proper support or resolution. not reliable for commodity trading.",1,4,18.9.0,google_play
i didn't receive my money yet. i checked my bank statement and everything. i tired to contact support team and everyone is saying wait 48 hrs since 6 may and today is 18 may. and my money is invested in mutual fund they are saying we sent money. i tired everything i didn't receive my funds...,1,0,,google_play
"groww is one of the best trading and investing apps i've used. the interface is clean, beginner-friendly, and very smooth to navigate. opening stocks, mutual funds, sips, and even f&o trading is simple and fast. i also like how transparent the app feels with charges and portfolio tracking. customer support and updates have improved a lot too. great app for both beginners and experienced investors. highly recommended!",5,5,18.9.0,google_play
add a way to check the overlap between various funds in some comparison section and allow large number of funds to be compared simultaneously. this is a very basic thing.,4,4,18.9.0,google_play
"i am facing significant difficulties in correcting my name on my groww account. even the customer support representatives are giving conflicting information—telling me to fill out a form and mail it to their office, and stating that the name change process will take 10 to 15 days. i earnestly request groww to introduce an online option for name changes so that users do not have to go through such hassle. i also hold an account with angle one, where my name was successfully updated online 1 hour",1,2,18.9.0,google_play
this is app is now a big fraud manipulated application please delete guys this is cheater,1,1,18.9.0,google_play
worst platform ever to trade and worst customer service lots of glitches and order doesn't execute on time,1,1,18.9.0,google_play
the worst app is hanging up when the index gets up or downwards.,1,1,18.9.0,google_play
"easy use, no withdraw issue, instant deposit, easy searc hand find out, also get your profit loss report.",5,1,18.9.0,google_play
the most pathetic website for novices like <URL>ey keep on refunding my money saying that the stock price is more even though i have added money into my account for this purpose...i also am unable to sell my shares becos none of their agents respond to my chat <URL>ey close the chat even though i say i am not satisfied...i don't know how to get out of <URL>eee,1,3,18.9.0,google_play
how do i change mobile number i lost my phone or sim card no access old account,5,0,,google_play
alert notification not working. other notification coming in groww but not alerts it's enabled in setting but not coming it's happening again,1,298,18.9.0,google_play
very very very very worst app and platform.,1,0,18.9.0,google_play
good app grow my use aftar four year but charges <PERSON> chahiye,4,1,18.9.0,google_play
"i began my investment journey through this app. it has been an year, and there was no problem. it's user friendly and the ai customer service solves your basic understanding too.",5,1,18.7.1,google_play
"groww ui is good and simple for new users. the app has introduced many updated features over time. however, i am giving 1 star because of poor customer support. whenever you raise a ticket, customer support asks for the same information again and again. repeating details 2–3 times is understandable, but asking for the same information 5+ times is frustrating. additionally, representatives often do not answer the actual questions and instead provide random or irrelevant responses.",1,8,18.9.0,google_play
customer sport not good but app is ok and his brokerage is highly then other app,3,0,18.7.1,google_play
"worst app, download of statements will take much time,still not <URL>ter zerodha than <URL>ill not downloading statements and the data is not updated of fundamentals of company always fixed",1,0,,google_play
nothing more i know when <PERSON> able to understand the market i can make millions from here,5,1,18.9.0,google_play
best ui among all other stocks related applications,4,1,18.9.0,google_play
they make this app as recharge app. is there any requirement to include the pay section. i am going to close it.,1,1,18.9.0,google_play
smooth and hassle free.. bit some time very lag for sale order to <URL>al time market suggestions not enough..if grow charge much brokerage than why you not provided data analysis...,1,1,18.9.0,google_play
"multiple time payment errors happened, the payment page did not even load",3,0,18.9.0,google_play
nice but brokerege heavy cost brokerege down pls,5,0,18.8.1,google_play
worst customer support.. they are clueless on their own app and unable to provide the support and answer the query raised on the discrepancy.,1,3,18.9.0,google_play
"hello grow team, i have a request for you: please include a 'paper trading' option in this application. this would allow users to thoroughly learn how to trade before investing any actual money. if the practice experience is robust, it could even enable users to pursue trading as a career in the future. i hope you will accept this request and implement it within the application. thank you.",1,1,18.7.1,google_play
the customer care service is very poor. whenever i called they put me on waiting for 20 min and then said thanks for talking to expert agent whereas no agent has talked to me.,1,1,17.70,google_play
keep updating the ui with more up-to-date features! good experience for new users.,5,1,18.9.0,google_play
"excellent, nice app i must give 5 star rating",5,0,18.9.0,google_play
you devs vibration off option should be there in grow <URL>'s extremely annoying plz don't vibrate phone excessively.,1,0,15.54,google_play
very good to use and easy ui that make it easy i think it is the best broker i ever seen .,5,1,18.9.0,google_play
now i am out of country how to buy sell mobile no not active.,5,0,18.9.0,google_play
i have lost my money due to a glitch don't install this app.,1,2,18.9.0,google_play
give recommendations on buying and selling good stocks,5,1,18.9.0,google_play
"i have been using the groww app for a while now, and it has made investing incredibly simple. the user interface is clean, smooth, and very easy to navigate, even for beginners. tracking my mutual funds and stocks is seamless. highly recommended for anyone looking to start their investment journey!",5,0,,google_play
this is worst app. charges are more than profit.,1,1,18.9.0,google_play
"if there were an option to show which mutual funds in my portfolio are performing well and which are underperforming, it would be much easier for us to track them.",5,1,18.9.0,google_play
thank you for sav may many i bay mon.17. nov.2025 11.7 rupees bay mtf pledging many 25000 and my many 5000 and i hold 6 month is no return is loss bat thanks for sav my 2700 rupees thank you my broker cancel mtf trading automate,5,0,,google_play
very bad app because apply many hidden charges and the brokerage is very high,1,1,,google_play
"the features are decent, but the transaction fees are significantly higher than those of its peers.",2,1,18.9.0,google_play
please add keep screen on option on groww. like tradingview,4,0,,google_play
good to use all ipo & mfund over there.,5,0,18.9.0,google_play
"the growth stock hair tool is an automated trading script designed to analyze historical data, identify multi-bagger candidates, and forecast market performance. users on financial forums like reddit praise its time-saving capabilities and visual backtesting features, but note that it requires a solid foundational understanding of market <URL>fore investing in any growth stock, perform comprehensive technical validation. utilize the tradingview charting platform to overlay price action.",5,0,18.9.0,google_play
the app is disturbing my experience. i am unable to download the update and only this app is not downloading. kindly fix it.,2,3,18.9.0,google_play
very good service. request to give some tips,5,0,18.9.0,google_play
not able to log in showing error-an unexpected error is.occured please try again...,1,1,,google_play
wrost app ever seen although i am using the <URL>ximum time there is manipulation in the app.whenever market going up or down in your traded direction they updated the profit very slow n opposite to this loss updated with 10x <URL> it is possible dont know but i want to tell everyone they are not only platform for <URL>ese all app have special benefits whenever maximum users are in loss......,1,5,18.8.1,google_play
good and <PERSON> i love <PERSON> march,5,0,,google_play
when we are paying this much brokerage to grow then grow should also be responsible for the trader facilities like kills switch option in option trading which protect their capital and stop over trading but only temporary pause which is not useful i am very much regretting to use this app,1,4,18.9.0,google_play
"groww: the wonder box very simple but excellent app for trading in stocks, mf etc excellent user friendly and superfast ui. buy, sell orders executed in seconds with ddpi caution shown during buy orders is highly helpful. we can get lot of information of a stock including overview, technicals, news/ latest news etc., graphs including smaller graphs are guiding pathways, help us take informed decisions.",5,6,18.9.0,google_play
bring dual screen option in f&o in mobile scalper mode.,4,0,18.9.0,google_play
it was an amazing app not only for investing but if we need any help it's cyber help center is quick to help his customer's,5,1,18.9.0,google_play
"interface is good, but entry point is manipulated by them in buying and selling never enter without mentioning exact price other wise app will give you whatever is worst possible entry point. brokerage charges will bite. app lags a lot.",2,6,18.9.0,google_play
this app very slow not good for users,1,1,18.9.0,google_play
this app is good for mutual funds but very bad for stocks. grow app charges rs 400 for a profit of rs 500. the most costlly grow app for stock.,2,0,,google_play
session expires is coming on my grow account due to which i have suffered financial loss today please tell me what to do,5,0,18.9.0,google_play
"money is 100% safe, deposit & withdrawal process are very fast",5,0,18.2.1,google_play
alert option not working in both android and ios,2,0,18.9.0,google_play
best app for beginner easy to use and understand,5,1,18.9.0,google_play
they said brokerage is maximum 20 but it is charging around 50,1,1,18.9.0,google_play
please include a feature to show the dividend dashboard earned lifetime stock wise.,2,0,18.9.0,google_play
"customer service is total waste. for the first time i called customer care, the support executive was not able to resolve the issue or rather i would say was not inclined to listen the query and resolve the issue. also, very unprofessional tone. didn't knew the process, also not ready to share details. now the groww is nunber ine broker in <LOCATION>. but if this sort of support continues, it's bound to go downhill from here. totally disappointed.",1,8,18.9.0,google_play
"one small feedback if you can add all time high nav, 52 week high & low nav to all the mutual funds it would be great.",5,1,18.9.0,google_play
i would be pleased by adding trail jump in option trading as seen in some other platform.. i miss trail jump in groww.,2,11,18.9.0,google_play
my purchased stock sells without my concern after 3:20 pm . and charges cut higher than usual earlier.,1,1,,google_play
relly it is a good app for investment and sip and it is a real life broker,5,0,18.9.0,google_play
i using it for around 2 month's and i invested on a cap fund it goes up and i got 549 but when i redeem it i goes down and down and i got only 525. what is happening. then i mind to deleted my account from this app.,2,5,18.8.1,google_play
functional+ non functional features are very smooth . ui very easy to use. interactive application with updated info every hour.,5,2,18.9.0,google_play
negetive rating. zero <URL>d experience. when am providing all the proof perfectly and when my 2 mutual fund has changed to my new bank account then why one of my mutual fund is not changing it.,1,25,18.9.0,google_play
"if u have 1l capital and make 50k profit and withdraw 50k. then your net tradable balance will be 1l. with withdrawalble balance 50k and tradable (unsettled)50k. and if you incur loss of 90k and deposit the withdrawn balance again of 50k. then your balance will be 60k. but to them that 50k is there father's property and they make people and sebi fool, by using this scam and show there transaction history <URL>ameless scamsters. i've lodged complaint against u and next i am going to lodge fir.",1,1,18.9.0,google_play
"all is good, but need a kill switch on future & option, control' over treding, need kill switch",5,0,18.9.0,google_play
i got loss because of your app. glitch,1,1,18.8.1,google_play
very good app . i am extremely happy,5,0,18.8.1,google_play
easy interface app and good and easy to use. nice service help too,5,1,18.9.0,google_play
don't take any from them .if you take you will <URL>tal harrasment from agent,1,1,18.9.0,google_play
"glitch problem & commit big loss, charges anyone can go into depression.",1,1,17.88,google_play
very good experience to trade from this platform.,5,0,18.9.0,google_play
good aap but brokarage charges is so high,2,0,,google_play
<PERSON> is more than your profit please don't use it go for others,1,1,,google_play
