review_text,rating,thumbs_up_count,app_version,source
"hello groww app team, as you are aware, recent regulatory changes have made the ter of a mutual fund a highly volatile quantity. you need to urgently display the base expense ratio (ber) for better context. the ter id the ber plus brokerage costs plus taxes, and a single day of heavy trading by the fund manager caused the ter to misrepresent the actual value. this also masks actual increases in costs to the customer.",1,1,,google_play
current update is <URL>e app flicker constantly and i can't exit the trade i have taken. shortcut exit from position.,1,2,18.10.1,google_play
after the update of application you are not able to exit tour trade easily as application hang so much... <PERSON> by day application is going worse <URL>ease any other different <URL>ndly do not trade in grow as there are so many bug issue comes while trading....,1,2,18.10.1,google_play
"one of the best trading apps for beginners, and now equally great for professional traders. the 1-tap trading feature makes execution much faster and smoother. overall, the experience has been excellent, and i highly recommend this app to everyone. my only request is to please launch the 1-tap trading feature for ios users as well. it would make the app even better.",5,1,18.10.1,google_play
i can't add my pan card it's going into a loop of aking pan then loging into relative account then again asking pan,1,0,18.10.1,google_play
"in trading there are many problems in live tracking and placing orders, limit orders are already kept at market price why , we need to delete then write then place, so hectic",2,1,18.10.1,google_play
on executing fno directly at positions app is showing glitch,4,0,18.10.1,google_play
nope it's fraud cuz while i sell my stocks the sell's price does not added to stock balance if u won't believe it then u see by adding 100 rupees and get a loss. fr,1,0,18.10.1,google_play
pathetic app pathetic customer care service that's why i love zerodha. groww is one of the worst app very bad.,1,0,,google_play
the nifty index chart lags in scalper chart. ce and pe are as per time. i have naked option bought and later i want to convert it to bull call strategy. the margin required get very high. why? bring safe exit commodity fno.,4,106,18.10.1,google_play
"after the recent update, the ui is not good. previous was good",1,0,18.10.1,google_play
this application doesn't deserve a single star. news was previously available but it's now disappeared. worst update done to the application.,1,0,18.10.1,google_play
"why did you removed news section from app , it was very helpful insight section , uninstalling the app soon , if that news section is not back , grow digest is useless to work with and waste of time also.",1,2,18.10.1,google_play
slow service. need to withdraw money from my wallet but the app says wait for 12 hrs.,1,0,18.10.1,google_play
"experience is nice , global indices charts should be visible just like nifty 50 in details along with <PERSON> , as indian markets are dependent on international factor",4,0,18.10.1,google_play
company financial performance section update is wrost. old is best great. not clear view and details. old is good. back old,1,0,18.10.1,google_play
grow application hang sometimes... and orders charges so much,2,0,17.78,google_play
apart from being simple and easy to use it is the most useless app in terms of interface lagging problems i have lost so many trades due to its lagging interface after each update it jumps way ahead from the previous problem and gives me more headaches in between trading time. that's why i am planning to shift my trading app to zerodha again,1,2,18.10.1,google_play
i use this grow app very long time this is useful and helpful and good service,5,0,18.9.0,google_play
kite app better than groww . because of charts and unable to place certain % percent of stoploss,1,0,,google_play
don't want to give a single star but without giving this can't place the review. the old application was good where we can see the news even when the market is closed. the updated application is more than the worst. worst application ever gone through.,1,0,18.5.0,google_play
the sorting option must include internal/external parameters as well for better user interface,3,0,17.50,google_play
bro don't use this app for investment they charge tooooo much and with sbi brokerage are irritating,1,0,18.10.1,google_play
"​""disappointed with the order execution speed. there is a consistent price gap of ₹2-₹3 between the price i order at and the price i get. this frequent slippage is directly causing bigger losses, and it has occurred around 5-6 times already. for option/intraday traders, this latency is unacceptable. please fix this bug.""",2,2,18.10.1,google_play
please don't choose this as your investment platform this is the worst brokerage i have dealt with they have many bugs and they are highly unresponsive,1,0,18.10.1,google_play
terrible service and customer support. they use chat bots in the name of cost cutting.,1,0,18.10.1,google_play
"the groww mutual fund app is a user-friendly and efficient investment platform that makes mutual fund investing simple for both beginners and experienced investors. with its clean interface, easy account setup, paperless kyc process, and access to a wide range of mutual funds, groww helps users make informed investment decisions. the app provides transparent information, real-time portfolio tracking, insightful fund analysis, and seamless transactions, making wealth creation accessible and conve",5,0,18.10.1,google_play
good app for grow up for businessman and also very,5,1,18.10.1,google_play
it's very helpful and easy way to the human body.i trust in groww.,5,0,18.10.1,google_play
"recent update of stocks should be included, as it's very useful for them who're not frequently updated for information or recent developments. detailed development of particular stocks should regularly updated and easily accessible like quaterly results, changes in shareholding pattern, block deals or partnerships etc. customer support is of very poor quality, they're not able to answer exactly what i was asking for.",2,1,18.10.1,google_play
improve your ads im not able to play my game because ur ads were gliching,1,0,,google_play
"u r standards have drastically come down, support response poor and u have not updated exit load for all mf and certain are updated incorrectly, portfolio graph has incorrect mapping, reported 3 months still not resolved some times is crashes and hangs these issue were never there before still dont have us stock buying options and nse (egrs) etc .. u need to improve stay at par with market needs basic is also lagging and new features are also not there",2,0,,google_play
very clear and informative for all needs regarding share investment.,5,0,18.9.0,google_play
this is trust worthy app u can invest happily <URL> worries..,5,0,18.10.1,google_play
"due app glitches, i lost around 3 lakhs",4,0,,google_play
decent app but really bad support. ai agents are useless and human agents are not informative enough. response comes in ages.,3,0,18.10.1,google_play
"much time technical problem and many order failed from groww ends and loss taken by customer. ofs failed,ipo order failed and some ipo alloted not showing in demat at the time of listing.",1,3,18.10.1,google_play
good for you and your money savings plan,5,0,18.10.1,google_play
i like this app! better then rest apps.,4,0,18.10.1,google_play
this app is useful app i am so happy with the app,5,0,18.10.1,google_play
very nice experience. easy to withdraw handle and operate too.,5,0,18.9.0,google_play
trying to use the app in <LOCATION>. keeps saying something went wrong!,1,0,18.10.1,google_play
third class app. app is not working getting something went wrong page.,1,0,18.10.1,google_play
fix the more issues plz and add the chart buy sl target features,5,0,18.10.1,google_play
"customer service poor still not resolved my issue almost twice time connected and updated , but tried to avoid what is the issue and reading a script?",1,1,18.10.1,google_play
"because you inform us of pcr information, fiis and diis data, doji candle stick",5,0,18.9.0,google_play
withdrawal process from app to account is little ridiculous,4,0,18.10.1,google_play
"it would be great and helpfull, if this platform provide us with folio/bucket feture, for goal based investments for any single choosen fund like hdfc liquid fund.",4,1,18.9.0,google_play
this app is really easy to use and has all the basic info needed by someone new.,5,1,18.10.1,google_play
cant handle the stock market fluctuations worst broker,1,0,18.10.1,google_play
always having network problem.. very poor application.. i am going to move to some other application,1,0,,google_play
in commodity is always hang and i lost money only because of stop loss there sale my silver mini stock zero because there not sell right time also when i set target also not working properly when i put target then not sell there not sale completely hopeless app there looting people money by name of stop last in target customer care also not responding i ask for refund there are not ready to pay but there agree everything there told me give 24 waitng 3 days,1,0,,google_play
"i can't believe it — i set a sell price, but the order took too long to execute, and the final sell value was different. sometimes it feels like there is cheating in exposure trading.",1,3,18.10.1,google_play
"very nice platform, groww trendin app good work.",5,0,18.9.0,google_play
the chart patterns are getting struck whats wrong with the new updates,3,0,,google_play
"no stability. they change layout at will which affect trading flow. fno section's layout has been changed which has made it more difficult and cluttered to execute trades on top of it it's glitchy. can't believe an app with do many subscribers can do such a poor job and can be so glitchy especially an app which deals with trading. when their customer care was approached the only answer they had was ""sorry for inconvenience"".",1,30,18.10.1,google_play
"absolutely terrible trading app. the customer support is useless, the fees are unpredictable, and the app conveniently starts glitching right in the middle of trades. every time there's a chance to book profit, something suddenly stops working. it honestly feels like the platform is designed to make sure users never actually make money. and the worst part.. their customer support somehow manages to make the whole experience even more frustrating.",1,1,18.10.1,google_play
but i always want that market will grow and grow but if you want to know about broker than really it's good and easy to use,5,0,18.9.0,google_play
"groww is indeed an excellent app to use , i only found 1 problem that is the block of indexes which you guys made smaller in equities section , i request you guys to make those blocks bigger like the blocks we use to get in fno section , because those smaller lines do damage your overall interface , also i again request you to increase the size of blocks of indexes on equities section , reff to the size same to the fno section",4,0,,google_play
wrost apk for future and options trading . not use for f&o trading,1,0,,google_play
"as a beginner investor, i was shocked to learn about all the charges involved — brokerage, dp charges, stt, gst, exchange charges, and even short-term capital gains tax. even if we make a small profit or sell at a loss, charges are still deducted. feels unfair when we take all the risk with our own money.",1,0,18.10.1,google_play
"dear groww tea, this is requested to you please ad an option in this app to switch account as of now every time i need to logout and again login this will reset all chart settings. so add a feature that just one click switch account and all settings remaining same for a user if he handle their family account.",3,2,18.10.1,google_play
"this app's ads are bothering me repeatedly, so i've given this app a 1-star rating.",1,0,,google_play
"i don't like the current way of showing income and profit of companies , please update back to the previous design.",1,0,18.10.1,google_play
"big in sclaper mode, not getting option to change index. please fix it",4,0,18.10.1,google_play
there is glitch new version please fix this.swipped left to right <URL>rsion is far best,1,0,18.10.1,google_play
a well-designed platform for stocks and mutual funds with a straightforward and intuitive user experience.,5,0,18.10.1,google_play
this app is very easy buying and selling and so smooth,5,0,18.10.1,google_play
"u guys have high trade charges but still, the mobile application doesn't have many tools and indicators even a text tool",5,2,18.10.1,google_play
very easy to learn for without shares knowledge,5,0,18.10.1,google_play
this app made a lot of loss and app doesn't give notification and the app is not good,1,1,18.10.1,google_play
the interface of this application is becoming increasingly poor and difficult to use with every update.,1,0,18.10.1,google_play
on grow app you should start forex trading,5,0,18.9.0,google_play
"no one explains anything how to use this app. no call, no email no message just everywhere asks for investment/add money. this should only get 5* if they guide for a week at least. what about beginners. i don't want to give 1*...",1,2,18.10.1,google_play
just stop this ad i am fed up,1,0,,google_play
it doesn't have the most needed details i.e. the avg price in the main window. instead of showing graph on the portfolio for each stock which doesn't make any sense u could have shown the relevant details,1,1,16.87,google_play
"this one is really good. very good, you like it very much, it deserves to be five stars.",5,1,,google_play
easy interface but a seperate news section should also be there.... it will be easy to do analysis of stocks.... what's ur opinion?,5,2,18.10.1,google_play
why don't you accept pay by credit card?,3,0,18.9.0,google_play
"love the app but switching to zerodha soon. why? no sip calculator. <PERSON>, upstox have it. groww is a unicorn but missing basic feature. add sip/lumpsum/goal calculator in next update = 5 star + lifelong user. till then 3 star only.",3,0,18.9.0,google_play
"grow chart interface is smooth and fast, but they should also add quarterly, half yearly and yearly timeframe candles.",4,2,18.10.1,google_play
very easy. very beginner friendly and actually helpful,5,0,18.10.1,google_play
"the app is riddled with glitches and faults. furthermore, they do not even answer the helpline number when needed. they also tamper with the account.",1,3,18.10.1,google_play
please add a feature to give a name(label) to invested funds so that a person can remember after few years for what purpose a particular saving/investment the user had started,1,1,18.10.1,google_play
please have option to remove externally imported funds,4,2,18.10.1,google_play
groww is best application for trading . beginner and expert,5,0,18.9.0,google_play
absolute cheap customer orientation. people in mass qty should leave this broker.,1,0,18.9.0,google_play
"need help is very useful it clear all doubts within seconds helps to new traders get confidence and stands for longtime and work, groww aap clears all my doubts and helped me to grow financially step by step, thank you grow",5,0,18.9.0,google_play
"suggestions in between browsing the shares is terrible. when i tried one share for delivery, after it became intraday. those changes should have been notified to me. it's terrible experience.",1,2,18.10.1,google_play
"groww made fno trading simple for me. ui is clean, app runs smoothly and overall experience has been good since i started.",5,0,18.9.0,google_play
"great for managing mutual funds, stocks, etfs, gold, and ipos in one place.",5,0,18.9.0,google_play
best invest app for all new comers . easy learning,5,0,18.9.0,google_play
its lucky app so nice thanks team groww,5,0,,google_play
very easy and smart investment app for common people of all types.,5,1,18.10.1,google_play
the basket mode only supports multiple options for one expiry date. baskets should support multiple expiry dates. also nifty and banknifty futures should be in the same basket along with their respective options. this will help against losses when options and futures are opened separately,4,1,18.10.1,google_play
"good app and all types of information regarding stockes, ipo and many more details are available in the app.",5,1,18.10.1,google_play
"""it is easy to operate and understand the data"".",5,0,18.9.0,google_play
sip daily nav timings not fix . pls make some corrections in timing of every mutual fund daily nav,3,1,18.10.1,google_play
vwap not show volume profile not show indicator not working please find out and request groww team trailing feature add this app all ok app,1,1,18.10.1,google_play
very simple and safe i like this app for tredding and sip i suggest you to youse it,5,1,18.10.1,google_play
add more indicators so we can trade smartly,4,1,18.10.1,google_play
my repayment rate is 99% still you dispointed i am really dispointed. i wanted create from new but still you did what you want..,1,0,18.6.1,google_play
profit and loss don't show like angel one,4,0,18.9.0,google_play
the overall experience is good .i'm using since 2021 and face no problem till today . thank you groww,5,0,18.9.0,google_play
the app is good overall. i miss absence of sorting option on stock name in trigger orders. a search option in trigger orders list would also help.,4,5,18.10.1,google_play
groww app is fake because if i apply for an ipo through any other app i get it. i don't get it through growup.,1,0,,google_play
today sensex 75900 put strike 3:30 pm in otm(value 32) after 2 min it's sudden shift itm automatically after market closed while on expiry cheating level groww up,1,3,18.10.1,google_play
"i purchased a few bonds few days back, some show in my holding the rest dont show, customer support says any bonds purchased through nse will not show in the holdings, this is a major drawback. secondly any complaints registered through the app do not show on the app for a follow up. i have been a zerodha user for long and unfortunately grroww does not match my expectations . groww needs to fix these issues on priority.",3,3,18.9.0,google_play
user interface is okay. but customer service is the worst. cce's are not available in your regional languages.,1,0,,google_play
"automatically placing double order not just one time but continuously 3 days same problem,, worst customer service also,, i wish i never used groww for trading",1,0,18.9.0,google_play
good job for every investor gwoww is a my family and friends,5,0,18.9.0,google_play
if you are a trader highly recommend please don't use this application if you does confirm you loss 50% of your capital due to this application.,1,0,,google_play
after update it became very slow and sluggish,2,2,18.10.1,google_play
it is worst app. it is taking money without permission,1,2,18.10.1,google_play
both simple n complex chart available easy n secured to use for all,5,0,18.9.0,google_play
wth is with this new update i'm unable to switch between indexs now,1,1,18.10.1,google_play
we are very bugs are face... please fix it,1,2,18.10.1,google_play
"i am using this app for almost last 4yrs, i have seen its development, its gradually, becoming more are more better day by day, easy to use, easy to <PERSON>. really great",5,2,18.9.0,google_play
"fully functional app, very informative and easy to use. no lag",5,0,18.9.0,google_play
please add treasury bills as soon as possible honestly i love this app,1,0,14.76,google_play
worst app they will literally charge so much of money so much of gambling,1,0,18.9.0,google_play
worst app showing different prices for the same time in options.while compared with angel one it is showing 70 rupees whereas at the same time groww is showing 55 rupees. why this price difference due to this so many losing <URL>so the order executions are not executed at same price. it is executing different price which you set the target.,1,3,18.9.0,google_play
"everything is in loss, one lakh in loss ,worst worst app ever worst experience",1,0,18.9.0,google_play
"best ,easy,good for evry one,but too much charges (intraday). this is negative point . so i m going to uninstall this app now ,looking for another application.",3,1,18.9.0,google_play
holding stock view sort options should include profit and loss in terms of amount high to low. after selling a stock its order history is not available in the stock interface as available while holding the stock. order history should be there after selling the stock. app not working getting hangged. unable to see holding section,1,9,18.9.0,google_play
excellent app with a very clean and user-friendly interface. investing in stocks and mutual funds has never been this easy. smooth transactions and great features. highly recommended,5,1,18.9.0,google_play
"biggest drawback is that i am unable to open multiple charts in mobile app. please fix it, overall grow is a user friendly app.",4,20,18.9.0,google_play
groww is really growing its relationship with its customers with trust. thanks to the groww team for their support when needed.,5,0,18.9.0,google_play
"its service is very poor, i have been using it for the last 3 years but if a sip gets started by mistake then they are saying that either i can stop it immediately or i can reduce the amount.",1,5,18.10.1,google_play
"great going, but no ofs option, and many mf are missing, and financial ratios too are missing",4,0,,google_play
very clean and user-friendly ui. investing feels simple even for beginners.,5,1,18.9.0,google_play
when i lock my phone and unlock again app not working all thing freeze,1,0,18.9.0,google_play
the transactions are somewhat jumbled when the positions are carried over night and sold the next day. please look into this matter.,4,0,18.9.0,google_play
"very bad experience with this app without information the brokerage charges increased, the charges are very high rs 5 per trade , without information implemented and not clarify the doubt. if you call them not answering properly and creating confusion",1,6,18.9.0,google_play
"charging too much, as compared to other apps.",1,0,18.9.0,google_play
the new charges of groww are really pathetic. sply depository charges only for women rs.3.25/ so disappointing.,2,1,18.9.0,google_play
"hello team, the old version of financial performance was good.",5,61,18.9.0,google_play
"please add real time total portfolio percentage of profit or loss for 24×7 like upstox, instead of sending portfolio alert day to day & there is bug in wishlist also i.e our portfolio stocks in wishlist show 0.00% change every time on interface while the reality after opening individual stock is different.",5,23,18.9.0,google_play
worst app ever <URL>eps crashing everytime and buy order don't excuse at the time and customer support is wrost .,1,0,18.9.0,google_play
no option for choosing hsbc bank. please enable it too,2,2,18.10.1,google_play
easy to trade and search easily any stocks.,5,0,18.9.0,google_play
"while trading they show old data and the second we end the trade it shows double or triple loss, , useless app for trading",1,0,18.6.1,google_play
i must say it's a best plateform of smooth trading,5,0,18.9.0,google_play
good app with all technical analysis of stock reviews.,5,0,18.9.0,google_play
good platform but withdrawal process make quick and prosperity.,5,0,18.9.0,google_play
chart analysis in the groww app used to be very good and convenient to use.,5,0,18.10.1,google_play
very nice and easy to use the application.,5,0,18.9.0,google_play
actually this is a phenomenal app. just like name groww you can also grow by trading with this app. good for beginners.,5,1,18.9.0,google_play
after used 4 years give my review excellent apps just say love it.. thanks groww such a beautiful design and easily operate..,5,2,18.10.1,google_play
please add share holding pattern like screener. its very easy to use .,5,0,18.9.0,google_play
nice app but the problem was u start getting calls from organizations promoting trading.,4,0,18.9.0,google_play
why you are asking for fee to update my email <URL>upid app,1,1,18.9.0,google_play
"if possible,pls tie up with good bank and provide 3in1 account.",3,1,18.9.0,google_play
initially i thought that it would be difficult for me but grow has made it easy,5,0,18.9.0,google_play
all profits they take in charge then what is the meaning of doing trading,1,1,,google_play
"it has been almost 2 years, but the profit has not been as much as was shown/promised",1,0,18.8.1,google_play
"i like how easy it is to use this app, and the payment through upi works perfectly every time.",5,0,18.9.0,google_play
this is one of the best in over all <LOCATION> it's simple and easy feature bigner user .,5,0,18.7.1,google_play
how i can rate the grow ? it is an impossible thing,5,0,18.8.1,google_play
"good for long term investment equity. not good for trading and f&o, bonds.",5,0,18.9.0,google_play
3rd class service service service service service was not available,1,0,18.9.0,google_play
mutual fund data not updated on apps please check....,1,0,,google_play
don't have many options to invest and even grow doesn't support to invester.,2,0,18.9.0,google_play
this best but use it safely very risk,4,0,18.9.0,google_play
why isn't there a sorting option in mutual fund watchlist???,3,0,18.9.0,google_play
"i'm disappointed with the groww app and the support i received. several times my orders were auto-executed or auto-cancelled without a clear reason, which caused confusion and potential financial loss. when i contacted customer service, the team was unable to resolve the issue and often used a rude, unhelpful tone. the inconsistent order behaviour combined with poor support makes the app unreliable for trading.",1,1,18.9.0,google_play
